{
  "schemaVersion": "r4.public-core-local-postgres-integration-campaign-inspect-fingerprint-correction-evidence.v1",
  "status": "GREEN",
  "generatedAt": "2026-08-17T07:24:13.221Z",
  "authority": {
    "addendumSha256": "sha256:ef63d738a208c3c2469e8c7f290daaf9ffe2e8166b696239436a3b22abf4bf39",
    "addendumHead": "25cf2b400d96a86c8017f7dbc2e2186fff7e9180",
    "addendumTree": "d858b46c9f6e83edd57db22033ce7458952f774f",
    "ownerReviewSha256": "sha256:f09f4b010a535dca9f9d11d9e07a31e82bd5a6e9b607def85648808130756c37",
    "ownerReviewHead": "eb9b3904131a682da6a85677494e97e5e2149bdb",
    "ownerReviewTree": "d92ce1354685205ddc64c3c3e1dc455cd8ecbce1"
  },
  "implementation": {
    "head": "169a05f0e00a5afdb9cc920c0d3591a90eaa4fe6",
    "tree": "efabdf042824e9fcde653006cdda58484deed38c",
    "parentHead": "eb9b3904131a682da6a85677494e97e5e2149bdb",
    "pathCount": 2,
    "aggregateSha256": "sha256:a3d507759c341d58f19a5aea7324641f8de86335ef9b1b21e32e1c0b1d73406e"
  },
  "artifacts": {
    "artifactIndexSha256": "sha256:d2d06ec56ba45098902ee862e105da8024eb1e57a6a99d926a4aacde647abfe3",
    "evidenceSchemaSha256": "sha256:a21933635e1c567405b00027c9b6b9da11860822573339022c1593c4bb63cf3f",
    "runnerSha256": "sha256:8742fdc0daa1617a70cfac8c0a2f53a17997c76681b9c6fc1b147e491e314fb0",
    "runnerTestSha256": "sha256:a04165d988cdfcde105a569ce629e57b6b3851119b30fb27f998707a207b6097"
  },
  "capturedFingerprint": {
    "kind": "container.inspect",
    "target": "forme-r4-public-core-local-b92ae04555cc3d69",
    "spawnOutcome": "COMPLETED",
    "exitStatus": 1,
    "signal": "NONE",
    "stdoutBytes": 1,
    "stdoutSha256": "sha256:01ba4719c80b6fe911b091a7c05124b64eeece964e09c058ef8f9805daca546b",
    "stdoutUtf8": true,
    "stdoutLineEndings": "LF",
    "stdoutLineCount": 1,
    "stderrBytes": 105,
    "stderrSha256": "sha256:36557984fb7353759773898446bc48f3ccc9ad3489f53f5b52ee2c7b3cdf83f3",
    "stderrUtf8": true,
    "stderrLineEndings": "LF",
    "stderrLineCount": 1
  },
  "failedV3": {
    "root": "/Users/zaynw/.forme-r4-integration-campaign-v3-37adbcbb",
    "grantSha256": "sha256:b172216dc673fe42456b94f3e64790e7866ec097c59039a4952ccc8ea2714fa7",
    "evidenceSha256": "sha256:06c21a912e1082078ccd14d36b68e564f979fbde3b7133e3743bbe8886026cac",
    "evidenceByteCount": 10460,
    "journalEntryCount": 9,
    "journalHeadSha256": "sha256:696c92d3f404e4ea44d315c4bb1eb86f8e1ae9b1c7c6ffbda616bd488223b9b5",
    "physicalExecuted": false,
    "postgresObserved": false,
    "freshResidueCount": 0
  },
  "validation": {
    "focused": { "status": "GREEN", "pass": 15, "fail": 0, "cancelled": 0 },
    "runner": { "status": "GREEN", "pass": 189, "fail": 0, "cancelled": 0 },
    "r4Offline": { "status": "GREEN", "pass": 761, "fail": 0, "cancelled": 0 },
    "gateBCore": { "status": "GREEN", "pass": 146, "fail": 0, "cancelled": 0 },
    "spine": { "status": "GREEN", "pass": 45, "fail": 0, "cancelled": 0 },
    "typecheck": "GREEN",
    "roomNoAi": "GREEN",
    "docsAudit": "GREEN",
    "inventory": {
      "status": "GREEN",
      "fileCount": 305,
      "sha256": "sha256:7b768d9c10f3dd96c765672243212e097d941d0860aec63368c46082c11d29b8"
    },
    "diffCheck": "GREEN",
    "aggregateHarnessObservation": {
      "firstAttempt": "143_PASS_0_FAIL_1_CANCELLED_PENDING_PROMISE",
      "focusedMacos": "11_PASS",
      "exactRerun": "146_PASS"
    }
  },
  "effects": {
    "docker": 0,
    "network": 0,
    "postgres": 0,
    "sql": 0,
    "productRuntime": 0,
    "production": 0,
    "publication": 0,
    "provider": 0,
    "message": 0,
    "spend": 0,
    "gateC": 0
  },
  "readiness": {
    "runnerCorrected": true,
    "bodyFreeFingerprintClosed": true,
    "statusFreezeComplete": false,
    "finalAuthorityFrozen": false,
    "physicalExecuted": false,
    "targetPostgresObserved": false,
    "productionReady": false,
    "gateCReady": false
  },
  "documentationScope": {
    "operationalCurrentStatusSurfacesCurrent": false,
    "wholeRepositoryDocumentationCurrentClaimed": false
  },
  "stop": "LOCAL_POSTGRES_INSPECT_FINGERPRINT_IMPLEMENTATION_EVIDENCE_GREEN / STATUS_FREEZE_REQUIRED / PRODUCTION_NOT_REQUESTED / GATE_C_NOT_REQUESTED"
}
